{
  "schemaVersion": "1.0",
  "sessionId": "5803f871-9fca-4a7f-a2c7-9b567a92a6cf",
  "serverTime": "2026-09-02T07:11:10.500Z",
  "elapsedTimeMs": 10500,
  "status": "MEASURING",
  "left": {
    "connected": true,
    "lastSequence": 111,
    "deviceTimeMs": 1110,
    "sensorValues": [
      12.1,
      24.6,
      51.0,
      80.2,
      61.3,
      30.2,
      12.0,
      8.1
    ],
    "totalPressure": 279.5,
    "cop": {
      "x": 0.42,
      "y": 0.73
    },
    "contactState": "CONTACT",
    "lastReceivedAt": "2026-09-02T07:11:10.490Z"
  },
  "right": {
    "connected": true,
    "lastSequence": 111,
    "deviceTimeMs": 1110,
    "sensorValues": [
      10.0,
      23.1,
      49.0,
      77.1,
      58.0,
      28.2,
      11.0,
      7.2
    ],
    "totalPressure": 263.6,
    "cop": {
      "x": 0.46,
      "y": 0.7
    },
    "contactState": "CONTACT",
    "lastReceivedAt": "2026-09-02T07:11:10.492Z"
  },
  "quality": {
    "score": 92,
    "level": "GOOD",
    "flags": []
  }
}
